{
    "$schema" : "http://json-schema.org/draft-04/schema",
    "id" : "tileset.schema.json",
    "title" : "Tileset",
    "type" : "object",
    "description" : "A 3D Tiles tileset.",
    "properties" : {
        "asset" : {
            "$ref" : "asset.schema.json"
        },
        "properties" : {
            "description": "A dictionary object of metadata about per-feature properties.",
            "patternProperties" : {
                ".*": {
                    "$ref": "properties.schema.json"
                }
            }
        },
        "geometricError" : {
            "type" : "number",
            "description" : "The error, in meters, introduced if this tileset is not rendered. At runtime, the geometric error is used to compute Screen-Space Error (SSE), i.e., the error measured in pixels.",
            "minimum" : 0
        },
        "root" : {
            "description" : "The root node.",
            "$ref" : "tile.schema.json"
        }
    },
    "required" : ["asset", "geometricError", "root"],
    "additionalProperties" : false
}
